<?xml version="1.0" encoding="UTF-8" standalone="yes"?><?xml-stylesheet type='text/xsl' href='history.xsl'?>
<Chat xmlns:xsi="http://www.w3.org/2001/XMLSchema-instance" xsi:noNamespaceSchemaLocation="chat.xsd">
    <Message color="rgb(255,255,255)" font="Arial Black">
        <Sender id="62">hello Salma</Sender>
        <Receiver id="64"/>
    </Message>
    <Message color="rgb(0,51,51)" font="Arial Black">
        <Sender id="62">moustafa</Sender>
        <Receiver id="64"/>
    </Message>
    <Message color="rgb(0,51,51)" font="Arial Black">
        <Sender id="62">moustafa</Sender>
        <Receiver id="64"/>
    </Message>
    <Message color="rgb(255,255,255)" font="Arial Black">
        <Sender id="64">moustafa</Sender>
        <Receiver id="62"/>
    </Message>
    <Message color="rgb(255,255,255)" font="Arial Black">
        <Sender id="64">ssss</Sender>
        <Receiver id="62"/>
    </Message>
    <Message color="rgb(255,255,255)" font="Arial Black">
        <Sender id="64">assdsa</Sender>
        <Receiver id="62"/>
    </Message>
    <Message color="rgb(255,255,255)" font="Arial Black">
        <Sender id="64">moudg</Sender>
        <Receiver id="62"/>
    </Message>
</Chat>
